﻿,,,,,,,,,,,,,,,,,,,,,,,,,,,
Disclaimers,,,,,,,,,,,,,,,,,,,,,,,,,,,
• This is an analytics report and currently we support downloading top 8000 listings by sold quantity.,,,,,,,,,,,,,,,,,,,,,,,,,,,
• This report ONLY includes listings sold within the selected time range. Any fees charged or credits applied to listings sold outside this time range are not included in this report. These fees and credits are included in the selling costs number shown on the Seller Hub Performance sales report dashboard.,,,,,,,,,,,,,,,,,,,,,,,,,,,
• Any fees charged or credits applied to these listings outside this time range are not included in this report.,,,,,,,,,,,,,,,,,,,,,,,,,,,
• You had $323.83 of account level fees during this time period. Here is the breakdown of these fees.,,,,,,,,,,,,,,,,,,,,,,,,,,,
Subscription fees = $323.83,,,,,,,,,,,,,,,,,,,,,,,,,,,
"• For the orders that have more than one unique item (multi-item orders), the order level fees/costs are distributed in individual items as follows. Total shipping label cost and per order fixed final value fees are equally distributed to each item.",,,,,,,,,,,,,,,,,,,,,,,,,,,
,,,,,,,,,,,,,,,,,,,,,,,,,,,
"Report for Jan 1, 2024 to Sep 29, 2024",,,,,,,,,,,,,,,,,,,,,,,,,,,
Listing title,eBay item ID,Store category L1,Store category L2,Quantity sold,Total sales (Includes taxes),Item sales,Taxes and government fees paid by buyer to you,Taxes and government fees paid by buyer to eBay,Shipping and handling paid by buyer to you,Total selling costs,Insertion fees,Optional listing upgrade fees,Final value fees,Promoted Listings - General fees,Promoted Listings - Priority fees,Ads Express fees,Promoted Offsite - Fees,International fees,Other eBay fees,Deposit processing fees,Fee credits,Shipping labels cost (Amount you paid to buy shipping labels on eBay),Net sales (Net of taxes and selling costs),Average Selling price,Quantity sold via promoted listing,Quantity sold via Best Offers,Quantity sold via Seller Initiated Offers
"Puritan's Pride Chromium Picolinate 500 Mcg Yeast Free, 100 Count",196174487634,Other,-,17,$133.25,$129.43,$0.00,$3.82,$0.00,$24.29,$0.00,$0.00,$19.85,$4.44,$0.00,$0.00,$0.00,$0.00,$0.00,$0.00,$0.00,$0.00,$105.14,$7.84,6,0,0
Item ID 196183739105,196183739105,Other,-,10,$237.23,$223.90,$0.00,$13.33,$0.00,$50.48,$0.00,$0.00,$30.60,$13.72,$0.00,$0.00,$0.00,$0.00,$0.00,$0.00,$0.00,$6.16,$173.42,$23.72,6,0,0
"Green Mountain Coffee Roasters Dark Magic Decaf, Single-Serve  K-Cup Pods",196119901430,Other,-,9,$427.30,$421.04,$0.00,$6.26,$0.00,$70.02,$0.00,$0.00,$61.05,$16.96,$0.00,$0.00,$0.00,$0.00,$0.00,$0.00,$7.99,$0.00,$351.02,$47.48,7,0,0
"Perrier Sparkling Water, 11.15 Fl Oz Cans (Pack of 24)",196119906397,Other,-,9,$261.44,$257.78,$0.00,$3.66,$0.00,$57.03,$0.00,$0.00,$33.58,$18.00,$0.00,$0.00,$0.00,$0.00,$0.00,$0.00,$0.00,$5.45,$200.75,$29.05,6,3,0
"De Cecco Farfalle Pasta, 16 Oz",196187671324,Other,-,9,$56.27,$56.27,$0.00,$0.00,$0.00,$23.36,$0.00,$0.00,$7.65,$5.06,$0.00,$0.00,$0.00,$0.00,$0.00,$0.00,$0.00,$10.65,$32.91,$6.25,9,0,0
"Splash Blast Mandarin Orange Flavored Water, 16.9 fl oz, 6 Pack",196187676847,Other,-,9,$70.27,$70.27,$0.00,$0.00,$0.00,$16.21,$0.00,$0.00,$9.88,$6.33,$0.00,$0.00,$0.00,$0.00,$0.00,$0.00,$0.00,$0.00,$54.06,$7.81,9,0,0
"Yonex GR 303 Combo Badminton Racquet with Full Cover, Set of 2 (Black)",196129267629,Other,-,8,$347.85,$319.57,$0.00,$28.28,$0.00,$76.32,$0.00,$0.00,$51.95,$23.50,$0.00,$0.00,$0.00,$0.87,$0.00,$0.00,$0.00,$0.00,$243.25,$43.48,6,0,0
"Kirkland Signature S'more Caramel Cluster, 26.3 Ounce",196183834750,Other,-,8,$174.48,$169.80,$0.00,$4.68,$0.00,$31.00,$0.00,$0.00,$23.14,$7.78,$0.00,$0.00,$0.08,$0.00,$0.00,$0.00,$0.00,$0.00,$138.80,$21.81,4,2,0
Member's Mark Restaurant Black Pepper (18 oz.),196169912070,Other,-,7,$102.31,$100.60,$0.00,$1.71,$0.00,$17.55,$0.00,$0.00,$18.26,$3.88,$0.00,$0.00,$0.00,$0.00,$0.00,$0.00,$4.59,$0.00,$83.05,$14.62,4,1,0
"StarKist Chunk Light Tuna in Oil, 5 Oz, Pack of 12",196183739969,Other,-,7,$127.40,$127.40,$0.00,$0.00,$0.00,$27.50,$0.00,$0.00,$16.03,$11.47,$0.00,$0.00,$0.00,$0.00,$0.00,$0.00,$0.00,$0.00,$99.90,$18.20,7,0,0
"SKITTLES Valentine's Day Wild Berry Chewy Candy, Sharing Size, 15.6 oz Bag",196187717340,Other,-,7,$58.97,$55.37,$0.00,$3.60,$0.00,$12.99,$0.00,$0.00,$7.68,$5.31,$0.00,$0.00,$0.00,$0.00,$0.00,$0.00,$0.00,$0.00,$42.38,$8.42,7,0,0
"Garden Of Life, Powder Protein Greens Chocolate Organic, 22 Ounce",196285901322,Other,-,7,$201.13,$188.96,$0.00,$12.17,$0.00,$41.81,$0.00,$0.00,$26.04,$9.54,$0.00,$0.00,$0.00,$0.00,$0.00,$0.00,$0.00,$6.23,$147.15,$28.73,4,5,0
"Campbell’s Chunky Soup, Savory Pot Roast Soup, 18.8 Oz Can",196133073231,Other,-,6,$41.27,$41.19,$0.00,$0.08,$0.00,$6.15,$0.00,$0.00,$6.00,$0.15,$0.00,$0.00,$0.00,$0.00,$0.00,$0.00,$0.00,$0.00,$35.04,$6.88,1,0,0
Ring Alarm Open Window Magnet (2nd Gen),196167804276,Other,-,6,$80.50,$75.37,$0.00,$5.13,$0.00,$13.86,$0.00,$0.00,$10.41,$7.27,$0.00,$0.00,$0.00,$0.00,$0.00,$0.00,$3.82,$0.00,$61.51,$13.42,6,1,0
"Clear Eyes Contact Lens Relief Eye Drops, 0.5 Fl Oz",196169183777,Other,-,6,$66.42,$63.51,$0.00,$2.91,$0.00,$12.44,$0.00,$0.00,$11.50,$2.34,$0.00,$0.00,$0.00,$0.00,$0.00,$0.00,$1.40,$0.00,$51.07,$11.07,3,0,0
"Seitenbacher Gluten Free Muesli Strawberry Natural Cereal, 13.2 Ounce",196183779424,Other,-,6,$112.38,$112.38,$0.00,$0.00,$0.00,$21.90,$0.00,$0.00,$14.78,$7.12,$0.00,$0.00,$0.00,$0.00,$0.00,$0.00,$0.00,$0.00,$90.48,$18.73,4,0,0
"TEMPTATIONS MIXUPS Crunchy and Soft Cat Treats Catnip Fever Flavor, 16 oz. Tub",196183821354,Other,-,6,$114.30,$109.01,$0.00,$5.29,$0.00,$24.87,$0.00,$0.00,$15.71,$9.16,$0.00,$0.00,$0.00,$0.00,$0.00,$0.00,$0.00,$0.00,$84.14,$19.05,5,2,0
"Garden of Life Probiotic Supplement - Primal Defense Dietary Supplement, 90 Capl",196285885611,Other,-,6,$515.12,$512.97,$0.00,$2.15,$0.00,$115.71,$0.00,$0.00,$64.81,$46.35,$0.00,$0.00,$0.00,$0.00,$0.00,$0.00,$0.00,$4.55,$397.26,$85.85,6,0,0
"Samsung Stove Knob Replacement DG94-03500A/Z, DG94-04167, DG94-03500U - Models N",196287212102,Other,-,6,$176.08,$165.16,$0.00,$10.92,$0.00,$31.40,$0.00,$0.00,$23.75,$7.65,$0.00,$0.00,$0.00,$0.00,$0.00,$0.00,$0.00,$0.00,$133.76,$29.35,3,2,0
"Caribou Coffee, Medium Roast Ground Coffee, Caribou Blend 20 Ounce Bag",196119899850,Other,-,5,$90.13,$87.50,$0.00,$2.63,$0.00,$17.74,$0.00,$0.00,$11.43,$6.31,$0.00,$0.00,$0.00,$0.00,$0.00,$0.00,$0.00,$0.00,$69.76,$18.03,5,5,0
"Cascade Complete Powder Dishwasher Detergent, Fresh Scent, 75 oz, White",196124107091,Other,-,5,$84.98,$79.22,$0.00,$5.76,$0.00,$17.09,$0.00,$0.00,$11.89,$5.20,$0.00,$0.00,$0.00,$0.00,$0.00,$0.00,$0.00,$0.00,$62.13,$17.00,4,0,0
"Band-Aid Adhesive Bandages, Sensitive Skin, Hypoallergenic, XL, 7 ct.",196169178339,Other,-,5,$53.16,$49.32,$0.00,$3.84,$0.00,$11.95,$0.00,$0.00,$7.17,$4.78,$0.00,$0.00,$0.00,$0.00,$0.00,$0.00,$0.00,$0.00,$37.37,$10.63,5,0,0
"Ecover Automatic Dishwashing Tablets Zero, 25 Count, 17.6 Ounce",196169196129,Other,-,5,$143.42,$135.30,$0.00,$8.12,$0.00,$25.46,$0.00,$0.00,$18.31,$7.15,$0.00,$0.00,$0.00,$0.00,$0.00,$0.00,$0.00,$0.00,$109.84,$28.68,3,3,0
"PG Tips Premium Black Tea, Black Tea Pyramid Bags, 40 ct",196169216101,Other,-,5,$82.16,$81.35,$0.00,$0.81,$0.00,$11.34,$0.00,$0.00,$11.34,$0.00,$0.00,$0.00,$0.00,$0.00,$0.00,$0.00,$0.00,$0.00,$70.01,$16.43,0,0,0
Uvex Clear Plus Lens Tissues (S475),196169241105,Other,-,5,$110.09,$101.70,$0.00,$8.39,$0.00,$23.54,$0.00,$0.00,$13.90,$7.82,$0.00,$0.00,$0.00,$1.82,$0.00,$0.00,$0.00,$0.00,$78.16,$22.02,5,0,0
"Sunbelt Bakery Chocolate Chip Chewy Granola Bars, 50 - 1.0 OZ Bars (5 Boxes)",196171276611,Other,-,5,$117.00,$116.75,$0.00,$0.25,$0.00,$22.02,$0.00,$0.00,$15.96,$6.06,$0.00,$0.00,$0.00,$0.00,$0.00,$0.00,$0.00,$0.00,$94.73,$23.40,3,2,0
"Spring Valley - Glucosamine Chondroitin, Triple Strength, 170 Tablets",196174516134,Other,-,5,$40.82,$40.82,$0.00,$0.00,$0.00,$9.82,$0.00,$0.00,$12.23,$4.13,$0.00,$0.00,$0.00,$0.00,$0.00,$0.00,$6.54,$0.00,$31.00,$8.16,2,0,0
"Bob's Red Mill Oat Bran Hot Cereal, 18-ounce (Pack of 4)",196183781962,Other,-,5,$142.76,$139.81,$0.00,$2.95,$0.00,$34.50,$0.00,$0.00,$18.94,$8.84,$0.00,$0.00,$0.00,$0.00,$0.00,$0.00,$0.00,$6.72,$105.31,$28.55,3,2,0
"Bob's Red Mill Steel Cut Oats, 24-ounce (Pack of 4)",196183784501,Other,-,5,$100.51,$99.94,$0.00,$0.57,$0.00,$16.97,$0.00,$0.00,$15.06,$4.12,$0.00,$0.00,$0.00,$0.00,$0.00,$0.00,$2.21,$0.00,$82.97,$20.10,2,1,0
"Lundberg Family Farms Organic Jasmine Rice, California White, 32 Ounce",196183827663,Other,-,5,$55.00,$55.00,$0.00,$0.00,$0.00,$12.32,$0.00,$0.00,$7.09,$5.23,$0.00,$0.00,$0.00,$0.00,$0.00,$0.00,$0.00,$0.00,$42.68,$11.00,5,5,0
"Cascadian Farm Organic Granola, Oats and Honey Cereal, Resealable Pouch, 11 oz",196183835309,Other,-,5,$46.25,$46.25,$0.00,$0.00,$0.00,$10.27,$0.00,$0.00,$6.11,$4.16,$0.00,$0.00,$0.00,$0.00,$0.00,$0.00,$0.00,$0.00,$35.98,$9.25,5,0,0
"Tropical Fantasy Fruit Punch Premium Juice Cocktail, 22.5 Oz",196186681089,Other,-,5,$30.35,$28.10,$0.00,$2.25,$0.00,$6.78,$0.00,$0.00,$4.05,$2.73,$0.00,$0.00,$0.00,$0.00,$0.00,$0.00,$0.00,$0.00,$21.32,$6.07,5,0,0
"Morton Iodized Table Salt, 26 Oz, pack of 2",196187861342,Other,-,5,$77.62,$77.00,$0.00,$0.62,$0.00,$10.19,$0.00,$0.00,$10.19,$0.00,$0.00,$0.00,$0.00,$0.00,$0.00,$0.00,$0.00,$0.00,$66.81,$15.52,0,0,0
"NSF Certified Pre Workout Powder -C4 Ripped Sport, Fruit Punch Flavor",196191630432,Other,-,5,$74.54,$74.54,$0.00,$0.00,$0.00,$17.17,$0.00,$0.00,$21.22,$14.81,$0.00,$0.00,$0.00,$0.66,$0.00,$0.00,$19.52,$0.00,$57.37,$14.91,5,3,0
"Orgain Collagen + Superfoods with 20g Collagen & Vitamin C, 25.6 oz",196286076767,Other,-,5,$192.53,$187.34,$0.00,$5.19,$0.00,$42.32,$0.00,$0.00,$49.95,$35.25,$0.00,$0.00,$0.00,$0.00,$0.00,$0.00,$42.88,$0.00,$145.02,$38.51,5,0,0
Garden of Life Vegan Protein Powder - Raw Organic Meal Replacement Shake - Vanil,196286115926,Other,-,5,$214.81,$214.81,$0.00,$0.00,$0.00,$43.02,$0.00,$0.00,$27.33,$15.69,$0.00,$0.00,$0.00,$0.00,$0.00,$0.00,$0.00,$0.00,$171.79,$42.96,4,1,0
"NeoCell Liquid Collagen Supplement, Pomegranate, 16 oz.",196287026418,Other,-,5,$150.00,$150.00,$0.00,$0.00,$0.00,$32.43,$0.00,$0.00,$18.93,$13.50,$0.00,$0.00,$0.00,$0.00,$0.00,$0.00,$0.00,$0.00,$117.57,$30.00,5,0,5
"Ray-Ban Meta - Wayfarer (Standard) Smart Glasses - Shiny Black, Clear",196119576445,Other,-,4,"$1,248.08","$1,189.98",$0.00,$58.10,$0.00,$280.71,$0.00,$0.00,$305.76,$103.41,$0.00,$0.00,$0.00,$0.00,$0.00,$0.00,$128.46,$0.00,$909.27,$312.02,4,0,1
"McCormick Maple Extract with Other Natural Flavors, 2 fl oz",196125824128,Other,-,4,$37.72,$37.40,$0.00,$0.32,$0.00,$6.69,$0.00,$0.00,$5.56,$1.13,$0.00,$0.00,$0.00,$0.00,$0.00,$0.00,$0.00,$0.00,$30.71,$9.43,4,2,0
Ghirardelli Premium Assortment Chocolate Squares - 15.77oz bag,196125827137,Other,-,4,$77.76,$72.00,$0.00,$5.76,$0.00,$13.40,$0.00,$0.00,$9.90,$3.50,$0.00,$0.00,$0.00,$0.00,$0.00,$0.00,$0.00,$0.00,$58.60,$19.44,4,4,0
"Mt. Olive Pickle Juice 100% Kosher Dill Pickle Brine, 64 Ounce Bottle",196133079043,Other,-,4,$88.19,$88.19,$0.00,$0.00,$0.00,$19.63,$0.00,$0.00,$12.20,$7.43,$0.00,$0.00,$0.00,$0.00,$0.00,$0.00,$0.00,$0.00,$68.56,$22.05,4,1,0
"Nature's Path Organic Oats, Old Fashioned Oats, 18 Oz Canister",196167793819,Other,-,4,$40.42,$40.19,$0.00,$0.23,$0.00,$8.76,$0.00,$0.00,$5.89,$2.87,$0.00,$0.00,$0.00,$0.00,$0.00,$0.00,$0.00,$0.00,$31.43,$10.11,4,3,0
"Nature Valley Protein Granola Bars, Peanut Butter Dark Chocolate, 15 ct",196169201410,Other,-,4,$60.00,$60.00,$0.00,$0.00,$0.00,$13.11,$0.00,$0.00,$7.71,$5.40,$0.00,$0.00,$0.00,$0.00,$0.00,$0.00,$0.00,$0.00,$46.89,$15.00,4,4,0
Windex Vinegar Multi-Surface Cleaner 26 Ounce,196169214889,Other,-,4,$0.00,$0.00,$0.00,$0.00,$0.00,$22.76,$0.00,$0.00,$14.56,$8.20,$0.00,$0.00,$0.00,$0.00,$0.00,$0.00,$0.00,$0.00,-$22.76,$0.00,4,0,0
"Metagenics - UltraFlora Women's, 30 Count",196169251462,Other,-,4,$232.48,$232.48,$0.00,$0.00,$0.00,$45.62,$0.00,$0.00,$29.11,$16.51,$0.00,$0.00,$0.00,$0.00,$0.00,$0.00,$0.00,$0.00,$186.86,$58.12,4,0,0
"Lipton Iced Tea Bags, Bulk Tea, Great for Parties, 48 Gallon-Sized Tea Bags",196171228944,Other,-,4,$58.59,$57.66,$0.00,$0.93,$0.00,$11.86,$0.00,$0.00,$8.13,$3.73,$0.00,$0.00,$0.00,$0.00,$0.00,$0.00,$0.00,$0.00,$45.80,$14.65,3,0,0
"Frostline Vanilla Soft Serve Ice Cream Mix, 6 Pounds",196171234570,Other,-,4,$82.98,$82.98,$0.00,$0.00,$0.00,$16.99,$0.00,$0.00,$10.85,$1.95,$0.00,$0.00,$0.00,$0.00,$0.00,$0.00,$0.00,$4.19,$65.99,$20.75,1,3,0
Garden of Life - RAW Probiotics Men - 90 Vegetarian Capsules,196174565527,Other,-,4,$290.54,$290.54,$0.00,$0.00,$0.00,$56.96,$0.00,$0.00,$37.17,$18.48,$0.00,$0.00,$0.00,$1.31,$0.00,$0.00,$0.00,$0.00,$233.58,$72.64,3,0,0
"Frank's RedHot Original Hot Sauce, 12 fl oz",196183737604,Other,-,4,$35.24,$35.24,$0.00,$0.00,$0.00,$8.00,$0.00,$0.00,$4.65,$3.35,$0.00,$0.00,$0.00,$0.00,$0.00,$0.00,$0.00,$0.00,$27.24,$8.81,4,0,0
"Libby's Chicken Vienna Sausage in Chicken Broth, Canned Sausage, 4.6 OZ",196183778722,Other,-,4,$22.28,$22.28,$0.00,$0.00,$0.00,$5.17,$0.00,$0.00,$3.05,$2.12,$0.00,$0.00,$0.00,$0.00,$0.00,$0.00,$0.00,$0.00,$17.11,$5.57,4,0,0
"Maruchan Ramen Creamy Chicken Flavor, 3 Oz, Pack of 24",196186700212,Other,-,4,$55.13,$51.64,$0.00,$3.49,$0.00,$34.81,$0.00,$0.00,$7.21,$4.96,$0.00,$0.00,$0.00,$0.00,$0.00,$0.00,$0.00,$22.64,$16.83,$13.78,4,0,0
"Canada Dry Ginger Ale Soda, 12 fl oz cans (Pack of 12)",196186721049,Other,-,4,$60.16,$56.12,$0.00,$4.04,$0.00,$14.13,$0.00,$0.00,$8.64,$5.41,$0.00,$0.00,$0.08,$0.00,$0.00,$0.00,$0.00,$0.00,$41.99,$15.04,4,0,0
"Diamond Naturals Dog Food, Beef & Rice Formula, 40lb Bag",196187682560,Other,-,4,$277.24,$258.09,$0.00,$19.15,$0.00,$47.73,$0.00,$0.00,$35.44,$12.29,$0.00,$0.00,$0.00,$0.00,$0.00,$0.00,$0.00,$0.00,$210.36,$69.31,2,0,0
"OLD WISCONSIN Beef Sticks, High Protein, Gluten Free, 24 oz Jar",196187685349,Other,-,4,$101.04,$101.04,$0.00,$0.00,$0.00,$20.20,$0.00,$0.00,$13.38,$6.82,$0.00,$0.00,$0.00,$0.00,$0.00,$0.00,$0.00,$0.00,$80.84,$25.26,3,0,0
"Mylicon Gas Relief Drops, Dye-Free Formula, 1oz: Babies, Infants",196192382881,Other,-,4,$56.00,$56.00,$0.00,$0.00,$0.00,$12.26,$0.00,$0.00,$7.22,$5.04,$0.00,$0.00,$0.00,$0.00,$0.00,$0.00,$0.00,$0.00,$43.74,$14.00,4,4,0
"Stainless Steel Pull-Out Trash Drawer for Outdoor Kitchen, 10 Gallons",196289260802,Other,-,4,$763.62,$712.00,$0.00,$51.62,$0.00,$163.44,$0.00,$0.00,$94.71,$68.73,$0.00,$0.00,$0.00,$0.00,$0.00,$0.00,$0.00,$0.00,$548.56,$190.91,4,4,0
"Vitamin B2 400mg | 180 Tablets | Vegetarian | Non-GMO, Gluten Free",196116499080,Other,-,3,$59.07,$59.07,$0.00,$0.00,$0.00,$7.60,$0.00,$0.00,$7.60,$0.00,$0.00,$0.00,$0.00,$0.00,$0.00,$0.00,$0.00,$0.00,$51.47,$19.69,0,0,0
S.Pellegrino Sparkling Natural Mineral Water Unflavored 11.15 Fl. Oz Pack of 24,196119906328,Other,-,3,$66.00,$66.00,$0.00,$0.00,$0.00,$14.72,$0.00,$0.00,$8.45,$6.27,$0.00,$0.00,$0.00,$0.00,$0.00,$0.00,$0.00,$0.00,$51.28,$22.00,3,3,0
"CRAFTSMAN Home Tool Set / Mechanics Tools Kit, 102-Piece (CMMT99448)",196124091188,Other,-,3,$487.28,$456.81,$0.00,$30.47,$0.00,$92.13,$0.00,$0.00,$61.08,$30.70,$0.00,$0.00,$0.35,$0.00,$0.00,$0.00,$0.00,$0.00,$364.68,$162.43,3,0,0
Herring Whole Fish Dog Treat 3-Oz Bag,196124120595,Other,-,3,$58.56,$54.99,$0.00,$3.57,$0.00,$7.53,$0.00,$0.00,$7.53,$0.00,$0.00,$0.00,$0.00,$0.00,$0.00,$0.00,$0.00,$0.00,$47.46,$19.52,0,3,0
Breath Pearls Original Freshens Breath (50 softgels),196126109488,Other,-,3,$69.28,$63.27,$0.00,$6.01,$0.00,$11.98,$0.00,$0.00,$8.86,$3.12,$0.00,$0.00,$0.00,$0.00,$0.00,$0.00,$0.00,$0.00,$51.29,$23.09,3,0,0
"DenTek Comfort-Fit Dental Guards for Nighttime Teeth Grinding, 2 Count",196126111733,Other,-,3,$94.87,$88.72,$0.00,$6.15,$0.00,$19.16,$0.00,$0.00,$12.52,$6.64,$0.00,$0.00,$0.00,$0.00,$0.00,$0.00,$0.00,$0.00,$69.56,$31.62,3,0,0
WILSON Volleyball,196129267450,Other,-,3,$57.96,$54.43,$0.00,$3.53,$0.00,$11.12,$0.00,$0.00,$8.06,$3.06,$0.00,$0.00,$0.00,$0.00,$0.00,$0.00,$0.00,$0.00,$43.31,$19.32,2,1,0
"Signature's Dried Plums Pitted Prunes, 3.5 Pounds",196133078014,Other,-,3,$55.00,$55.00,$0.00,$0.00,$0.00,$9.88,$0.00,$0.00,$7.40,$2.48,$0.00,$0.00,$0.00,$0.00,$0.00,$0.00,$0.00,$0.00,$45.12,$18.33,3,3,0
"Swanson Canned Chicken a la King With White and Dark Chicken Meat, 10.5 OZ Can",196133082497,Other,-,3,$21.64,$20.91,$0.00,$0.73,$0.00,$3.92,$0.00,$0.00,$4.48,$0.65,$0.00,$0.00,$0.00,$0.00,$0.00,$0.00,$1.21,$0.00,$16.99,$7.21,3,0,0
Domino Sugar,196167758056,Other,-,3,$28.46,$28.46,$0.00,$0.00,$0.00,$7.74,$0.00,$0.00,$5.90,$1.84,$0.00,$0.00,$0.00,$0.00,$0.00,$0.00,$0.00,$0.00,$20.72,$9.49,2,1,0
"Sharpie Permanent Markers, Fine Point, Black, 12 Count",196169212447,Other,-,3,$54.48,$51.23,$0.00,$3.25,$0.00,$11.30,$0.00,$0.00,$7.43,$3.87,$0.00,$0.00,$0.00,$0.00,$0.00,$0.00,$0.00,$0.00,$39.93,$18.16,3,0,0
"Kashi GO, Breakfast Cereal, Original, Excellent Source of Fiber, 13.1oz Box",196169229492,Other,-,3,$23.25,$23.25,$0.00,$0.00,$0.00,$10.08,$0.00,$0.00,$8.83,$0.00,$0.00,$0.00,$0.09,$0.00,$0.00,$0.00,$5.56,$6.72,$13.17,$7.75,0,0,0
"Special K Cereal Cinnamon Pecan, 12.1 oz",196169230348,Other,-,3,$57.20,$54.21,$0.00,$2.99,$0.00,$17.58,$0.00,$0.00,$7.36,$5.15,$0.00,$0.00,$0.00,$0.00,$0.00,$0.00,$0.00,$5.07,$36.63,$19.07,3,0,0
"REESE'S Peanut Butter Snack Size Milk Chocolate Cups, 33 oz Bag (60 Pieces)",196171177181,Other,-,3,$54.69,$54.69,$0.00,$0.00,$0.00,$11.70,$0.00,$0.00,$7.05,$4.65,$0.00,$0.00,$0.00,$0.00,$0.00,$0.00,$0.00,$0.00,$42.99,$18.23,3,0,0
"Kirkland Signature Purified Drinking Water, 16.9 Ounce, 40 Count",196171181443,Other,-,3,$74.47,$74.47,$0.00,$0.00,$0.00,$16.98,$0.00,$0.00,$10.30,$6.33,$0.00,$0.00,$0.00,$0.35,$0.00,$0.00,$0.00,$0.00,$57.49,$24.82,3,0,0
"Tiptree Lemon Curd, 11 Ounce Jar (312g)",196171262555,Other,-,3,$48.56,$47.42,$0.00,$1.14,$0.00,$11.17,$0.00,$0.00,$6.90,$4.27,$0.00,$0.00,$0.00,$0.00,$0.00,$0.00,$0.00,$0.00,$36.25,$16.19,3,0,0
"Campbell’s Chunky Soup, Hearty Bean Soup With Ham, 19 Oz Can",196171264252,Other,-,3,$16.41,$16.41,$0.00,$0.00,$0.00,$2.33,$0.00,$0.00,$2.33,$0.00,$0.00,$0.00,$0.00,$0.00,$0.00,$0.00,$0.00,$0.00,$14.08,$5.47,0,0,0
"Heinz Cleaning Vinegar, 128 Fl Oz Bottle",196171285767,Other,-,3,$71.13,$71.13,$0.00,$0.00,$0.00,$19.67,$0.00,$0.00,$9.08,$6.40,$0.00,$0.00,$0.00,$0.00,$0.00,$0.00,$0.00,$4.19,$51.46,$23.71,3,0,0
"Nature's Bounty Fish Oil, Supports Heart Health, 2400mg, Coated Softgels, 90 Ct.",196174513144,Other,-,3,$65.34,$65.34,$0.00,$0.00,$0.00,$19.50,$0.00,$0.00,$8.47,$5.88,$0.00,$0.00,$0.00,$0.00,$0.00,$0.00,$0.00,$5.15,$45.84,$21.78,3,0,0
"GNC Mega Men Sport One Daily Mens Multivitamin, 60 CAPLETS",196174527900,Other,-,3,$54.25,$54.25,$0.00,$0.00,$0.00,$9.21,$0.00,$0.00,$7.50,$1.71,$0.00,$0.00,$0.00,$0.00,$0.00,$0.00,$0.00,$0.00,$45.04,$18.08,1,0,0
Horjoy Fruits/Veggies & Vitamins Capsules: Nature's 90 Fruit & 90 Veggie for Die,196183734242,Other,-,3,$171.32,$169.09,$0.00,$2.23,$0.00,$44.46,$0.00,$0.00,$21.86,$16.27,$0.00,$0.00,$0.00,$0.00,$0.00,$0.00,$0.00,$6.33,$124.63,$57.11,3,0,0
"Mrs. Butterworth Pancake and Waffle Mix, 32 Ounce",196183788866,Other,-,3,$21.11,$21.11,$0.00,$0.00,$0.00,$5.20,$0.00,$0.00,$3.30,$1.90,$0.00,$0.00,$0.00,$0.00,$0.00,$0.00,$0.00,$0.00,$15.91,$7.04,3,0,0
HORMEL COMPLEATS Protein Variety Pack Microwave Trays (Pack of 5),196183791307,Other,-,3,$72.83,$72.83,$0.00,$0.00,$0.00,$16.51,$0.00,$0.00,$9.60,$6.91,$0.00,$0.00,$0.00,$0.00,$0.00,$0.00,$0.00,$0.00,$56.32,$24.28,3,0,0
"Pacific Foods Organic Chicken Noodle Soup, 16.1 OZ",196183835134,Other,-,3,$22.50,$21.63,$0.00,$0.87,$0.00,$5.22,$0.00,$0.00,$3.08,$2.14,$0.00,$0.00,$0.00,$0.00,$0.00,$0.00,$0.00,$0.00,$16.41,$7.50,3,0,0
Organico Bello Organic Pasta Sauce Tomato Basil - 25 oz,196183836449,Other,-,3,$76.99,$76.99,$0.00,$0.00,$0.00,$12.29,$0.00,$0.00,$10.21,$2.08,$0.00,$0.00,$0.00,$0.00,$0.00,$0.00,$0.00,$0.00,$64.70,$25.66,1,0,0
"Muscletech Mass Gainer Mass-Tech Extreme 2000, Muscle Builder Whey Protein  6lbs",196186098218,Other,-,3,$176.45,$168.99,$0.00,$7.46,$0.00,$33.15,$0.00,$0.00,$22.69,$10.46,$0.00,$0.00,$0.00,$0.00,$0.00,$0.00,$0.00,$0.00,$135.84,$58.82,2,0,0
"7UP Cherry Flavored Soda, 12 fl oz cans (Pack of 12)",196186720795,Other,-,3,$45.46,$42.09,$0.00,$3.37,$0.00,$10.62,$0.00,$0.00,$6.52,$4.10,$0.00,$0.00,$0.00,$0.00,$0.00,$0.00,$0.00,$0.00,$31.47,$15.15,3,0,0
"Mrs. Meyer's All-Purpose Cleaner Spray, Lemon Verbena, 16 fl. oz - Pack of 3",196187690742,Other,-,3,$45.86,$45.03,$0.00,$0.83,$0.00,$10.40,$0.00,$0.00,$6.27,$4.13,$0.00,$0.00,$0.00,$0.00,$0.00,$0.00,$0.00,$0.00,$34.63,$15.29,3,0,0
"RXBAR Protein Bars: 12g Protein, GF Snacks, Chocolate Variety Pack (10 Bars)",196190504658,Other,-,3,$83.32,$79.32,$0.00,$4.00,$0.00,$18.39,$0.00,$0.00,$10.89,$7.50,$0.00,$0.00,$0.00,$0.00,$0.00,$0.00,$0.00,$0.00,$60.93,$27.77,3,1,0
"Pure Encapsulations Zinc 30mg - Immune Support, Highly Absorbable, 60 caps",196191878628,Other,-,3,$89.74,$88.37,$0.00,$1.37,$0.00,$20.66,$0.00,$0.00,$12.18,$8.07,$0.00,$0.00,$0.00,$0.41,$0.00,$0.00,$0.00,$0.00,$67.71,$29.91,3,0,0
"Ginger Drink Gold Kili 40 Sachets Packed in 2 Bags, 12.6 oz (With Honey)",196192376662,Other,-,3,$74.94,$74.94,$0.00,$0.00,$0.00,$14.61,$0.00,$0.00,$10.15,$4.46,$0.00,$0.00,$0.00,$0.00,$0.00,$0.00,$0.00,$0.00,$60.33,$24.98,2,0,0
NAVIGATING CHAOS: A Practical Handbook for Modern Survival,196279387496,Other,-,3,$59.03,$55.89,$0.00,$3.14,$0.00,$15.38,$0.00,$0.00,$8.29,$7.09,$0.00,$0.00,$0.00,$0.00,$0.00,$0.00,$0.00,$0.00,$40.51,$19.68,3,0,0
"Senior GSM Unlocked Cell Phone, 1.8"" Screen, Mini Three Proof, Factory Unlocked,",196279482297,Other,-,3,$110.12,$105.45,$0.00,$4.67,$0.00,$18.13,$0.00,$0.00,$11.00,$7.13,$0.00,$0.00,$0.00,$0.00,$0.00,$0.00,$0.00,$0.00,$87.32,$36.71,2,0,0
"Jethro Mobile Plan: No Contract, 8GB Data, Unlimited Talk & Text, SIM Kit (1 Yea",196279485023,Other,-,3,$0.00,$0.00,$0.00,$0.00,$0.00,$0.40,$0.00,$0.00,$38.83,$14.18,$0.00,$0.00,$0.00,$0.00,$0.00,$0.00,$52.61,$0.00,-$0.40,$0.00,1,2,0
Boron 10mg 240 Servings Ultra High Absorption Supplement,196283055681,Other,-,3,$62.49,$60.23,$0.00,$2.26,$0.00,$19.20,$0.00,$0.00,$8.92,$1.90,$0.00,$0.00,$0.00,$0.00,$0.00,$0.00,$0.00,$8.38,$41.03,$20.83,1,0,0
"Puritan's Pride Odorless Garlic 1000 Mg, 100 Total Count",196284962626,Other,-,3,$15.00,$15.00,$0.00,$0.00,$0.00,$2.15,$0.00,$0.00,$2.15,$0.00,$0.00,$0.00,$0.00,$0.00,$0.00,$0.00,$0.00,$0.00,$12.85,$5.00,0,3,0
Dr Formulated Garden of Life 3-in-1 Pre/Pro/Postbiotic - 50 Billion CFU - 30 Day,196285888261,Other,-,3,$186.70,$171.72,$0.00,$14.98,$0.00,$23.46,$0.00,$0.00,$23.46,$0.00,$0.00,$0.00,$0.00,$0.00,$0.00,$0.00,$0.00,$0.00,$148.26,$62.23,0,0,0
"Youtheory Ashwagandha Capsules, Maintain Cortisol, Reduce Stress, 60 Count",196286063775,Other,-,3,$83.60,$81.36,$0.00,$2.24,$0.00,$13.97,$0.00,$0.00,$11.53,$2.44,$0.00,$0.00,$0.00,$0.00,$0.00,$0.00,$0.00,$0.00,$67.39,$27.87,1,0,0
"Ka'Chava Chocolate Shake: 85+ Superfoods, 26g Nutrients, 25g Protein, 2lb",196286948805,Other,-,3,$258.60,$240.00,$0.00,$18.60,$0.00,$55.61,$0.00,$0.00,$32.34,$23.27,$0.00,$0.00,$0.00,$0.00,$0.00,$0.00,$0.00,$0.00,$184.39,$86.20,3,3,0
Groomie Charging Dock: Portable Stand for BaldiePro Trimmer,196287520533,Other,-,3,$127.21,$117.69,$0.00,$9.52,$0.00,$28.36,$0.00,$0.00,$16.91,$11.45,$0.00,$0.00,$0.00,$0.00,$0.00,$0.00,$0.00,$0.00,$89.33,$42.40,3,0,0
Duracell Coppertop AAA Alkaline Batteries 24/Pack (MN2400BKD) 2768002,196115526378,Other,-,2,$58.30,$55.00,$0.00,$3.30,$0.00,$7.50,$0.00,$0.00,$7.50,$0.00,$0.00,$0.00,$0.00,$0.00,$0.00,$0.00,$0.00,$0.00,$47.50,$29.15,0,0,0
"Campbell's Condensed Beef Broth, 10.5 Ounce Can (Case of 12)",196119909806,Other,-,2,$64.80,$64.80,$0.00,$0.00,$0.00,$12.25,$0.00,$0.00,$8.30,$3.95,$0.00,$0.00,$0.00,$0.00,$0.00,$0.00,$0.00,$0.00,$52.55,$32.40,2,0,0
Bob's Red Mill - 5 Grain Hot Cereal Rolled - Case Of 4 - 16 Oz,196119926351,Other,-,2,$35.52,$35.18,$0.00,$0.34,$0.00,$6.71,$0.00,$0.00,$5.09,$1.62,$0.00,$0.00,$0.00,$0.00,$0.00,$0.00,$0.00,$0.00,$28.47,$17.76,1,0,0
E-Z Pool All in One Pool Care Solution (Regular 5 lb),196124104609,Other,-,2,$216.63,$202.94,$0.00,$13.69,$0.00,$38.13,$0.00,$0.00,$27.55,$9.96,$0.00,$0.00,$0.62,$0.00,$0.00,$0.00,$0.00,$0.00,$164.81,$108.32,1,1,0
S.Pellegrino Sparkling Natural Mineral Water 8.45 fl oz. 6 Count,196125824124,Other,-,2,$47.30,$47.30,$0.00,$0.00,$0.00,$9.45,$0.00,$0.00,$6.14,$3.31,$0.00,$0.00,$0.00,$0.00,$0.00,$0.00,$0.00,$0.00,$37.85,$23.65,2,0,0
"TheraBreath Dry Mouth Lozenges with ZINC, Tart Berry Flavor, 100 Lozenges",196126111000,Other,-,2,$34.41,$32.42,$0.00,$1.99,$0.00,$6.39,$0.00,$0.00,$4.85,$1.54,$0.00,$0.00,$0.00,$0.00,$0.00,$0.00,$0.00,$0.00,$26.03,$17.21,2,0,0
"Speedo Unisex-Adult Swim Goggles Mirrored Vanquisher 2.0,Silver",196129267014,Other,-,2,$64.71,$60.62,$0.00,$4.09,$0.00,$14.74,$0.00,$0.00,$8.59,$6.15,$0.00,$0.00,$0.00,$0.00,$0.00,$0.00,$0.00,$0.00,$45.88,$32.36,2,0,0
YONEX Nanoray Light 18i Graphite Badminton Racquet (Black),196129267584,Other,-,2,$121.03,$111.68,$0.00,$9.35,$0.00,$19.60,$0.00,$0.00,$15.55,$4.05,$0.00,$0.00,$0.00,$0.00,$0.00,$0.00,$0.00,$0.00,$92.08,$60.52,1,0,0
"GHIRARDELLI Chocolate Squares, Peppermint Bark Assorted Chocolates, 20.99 OZ Bag",196133091650,Other,-,2,$48.25,$46.75,$0.00,$1.50,$0.00,$7.64,$0.00,$0.00,$6.56,$1.08,$0.00,$0.00,$0.00,$0.00,$0.00,$0.00,$0.00,$0.00,$39.11,$24.13,1,0,0
"Combos Cheddar Cheese Baked Pretzel Snacks, 13.5 Oz. Bag, 13.5 Oz",196133100864,Other,-,2,$25.93,$25.59,$0.00,$0.34,$0.00,$4.58,$0.00,$0.00,$3.80,$0.78,$0.00,$0.00,$0.00,$0.00,$0.00,$0.00,$0.00,$0.00,$21.01,$12.97,2,0,0
"IMUSA Electric NonStick Rice Cooker, 5-Cup (Uncooked)/10-Cup (Cooked), White",196137942384,Other,-,2,$88.30,$81.13,$0.00,$7.17,$0.00,$16.89,$0.00,$0.00,$11.51,$5.38,$0.00,$0.00,$0.00,$0.00,$0.00,$0.00,$0.00,$0.00,$64.24,$44.15,2,0,0
Vaseline Petroleum Jelly For Dry Cracked Skin and Eczema Relief Original 7.5 oz,196167758530,Other,-,2,$31.18,$29.00,$0.00,$2.18,$0.00,$6.36,$0.00,$0.00,$4.15,$2.21,$0.00,$0.00,$0.00,$0.00,$0.00,$0.00,$0.00,$0.00,$22.64,$15.59,2,0,0
PuriLens Plus Preservative Free Saline Three 4 Fl Oz(120-mL) Bottles,196167771525,Other,-,2,$53.79,$50.67,$0.00,$3.12,$0.00,$11.06,$0.00,$0.00,$7.24,$3.82,$0.00,$0.00,$0.00,$0.00,$0.00,$0.00,$0.00,$0.00,$39.61,$26.90,2,0,0
